@@,name,position
->,Anya Williams,Deputy Governor of the Turks and Caicos Islands->Deputy Governor of the Turks & Caicos Islands
---,Washington Misick,Premier of the Turks and Caicos Islands
---,Nigel Dakin,Governor of the Turks and Caicos Islands
---,Erwin Jay Saunders,"Minister of Finance, Investment & Trade"
---,Erwin Jay Saunders,Deputy Premier of the Turks and Caicos Islands
+++,Rhondalee Braithwaite-Knowles,Attorney General
+++,Rachel Marshall Taylor,"Minister of Education, Labour, Employment and Customer Service"
+++,Otis Chuck Morris,"Minister of Home Affairs, Public Utilities and Transportation"
+++,Nigel John Dakin,Governor of the Turks & Caicos Islands
+++,Josephine Olivia Conolly,"Minister of Tourism, Agriculture, Fisheries, Heritage & the Environment"
+++,Jamell Rayan Robinson,"Minister of Health, Agriculture, Sports & Human Services"
+++,Erwin Jay Saunders,"Deputy Premier and Minister of Finance, Investment & Trade"
+++,Charles Washington Misick,Premier of the Turks & Caicos Islands
+++,Arlington Alexander Musgrove,Minister of Immigration & Border Services
+++,Akierra Mary Deanne Missick,Leader of Government Business and Minister of Physical Planning & Infrastructure Development
